{
  "id": "0001",
  "title": "<short title>",
  "status": "draft",
  "scope": {
    "in": [],
    "out": []
  },
  "interfaces": {
    "commands": [
      {
        "name": "<command or endpoint name>",
        "input_schema": "<path or inline schema>",
        "output_schema": "<path or inline schema>",
        "preconditions": [
          {
            "id": "CMD-1-PRE-1",
            "statement": "<condition>",
            "enforcement": "<static|test|debug|runtime>",
            "mechanism": "<rust_type|rust_test|rust_debug_assert|rust_runtime_validation|ts_ux_validation>",
            "obligation": "<caller|system|both>"
          }
        ],
        "postconditions": [
          {
            "id": "CMD-1-POST-1",
            "statement": "<guarantee>",
            "enforcement": "<static|test|debug|runtime>",
            "mechanism": "<rust_type|rust_test|rust_debug_assert|rust_runtime_validation|ts_ux_validation>",
            "obligation": "<system>"
          }
        ],
        "errors": [
          {
            "id": "CMD-1-ERR-1",
            "code": "INVALID_ARGUMENT",
            "when": "<condition>",
            "enforcement": "<static|test|debug|runtime>",
            "mechanism": "<rust_type|rust_test|rust_debug_assert|rust_runtime_validation|ts_ux_validation>",
            "obligation": "<system>",
            "response": "<shape/fields>"
          }
        ]
      }
    ]
  },
  "data_contracts": [
    {
      "name": "<entity/event>",
      "schema": "<path or inline schema>",
      "invariants": [
        {
          "id": "DC-1-INV-1",
          "statement": "<invariant>",
          "enforcement": "<static|test|debug|runtime>",
          "mechanism": "<rust_type|rust_test|rust_debug_assert|rust_runtime_validation|ts_ux_validation>",
          "obligation": "<system>"
        }
      ]
    }
  ],
  "system_invariants": [
    {
      "id": "SYS-INV-1",
      "statement": "<invariant>",
      "enforcement": "<static|test|debug|runtime>",
      "mechanism": "<rust_type|rust_test|rust_debug_assert|rust_runtime_validation|ts_ux_validation>",
      "obligation": "<system>"
    }
  ],
  "observability": {
    "logs": [],
    "metrics": [],
    "traces": []
  },
  "acceptance_tests": [
    {
      "id": "AT-1",
      "description": "",
      "proves": [
        "CMD-1-PRE-1"
      ]
    }
  ],
  "open_questions": [],
  "assumptions": [],
  "definition_of_done": [
    "open_questions is empty",
    "acceptance_tests implemented and passing",
    "each clause id in pre/post/invariants/errors has a proof entry in evidence.json",
    "Rust enforcement is authoritative; TypeScript enforcement is UX-only"
  ]
}
